"text","language","style"
"days ahead of an election to replace him at the helm of the Caucasus republic where a five-year guerrilla war shows no signs of dying down. A Malaysian woman is trying to reclaim the world record for the longest stay in a room full of scorpions, news reports said Sunday.","en","news"
"by fears for the solvency of the Russian oil giant Yukos, and by surging demand for oil in Asia, notably in China. Australia #39;s Fortescue China Deal On Pilbara Rail MELBOURNE (Dow Jones)--Australian iron ore company Fortescue Metals Group Ltd. (FMG. AU) said Monday it has entered into a contract with China Railway Engineering Corp.","en","news"
"McGreevey had told him he was determined to hold office until Nov. removing the possibility of a special election. Maintaining that a failed referendum to oust Venezuela's president was rigged against them, opposition leaders Wednesday refused to participate in a partial audit of the results as proposed by former President Jimmy Carter.","en","news"
"Ulmer resets record, wins gold Sarah Ulmer won New Zealand #39;s first Olympic cycling gold medal Sunday, shaving almost two more seconds off the world mark she set Saturday in the women #39;s individual pursuit. Paula Radcliffe #39;s entrance to the Panathinaiko Stadium was not supposed to have been like this.","en","news"
"New Device: Flying Robot Seiko Epson hopes the tiny robot will help in security, disaster and rescue and space exploration. Also: Apple recalls batteries from its 15-inch PowerBook G4 laptops   hellip;. Sony unveils eight new flat-screen TVs   hellip;. and more. The dollar fell to a new record low  against the euro on Tuesday as investors,","en","news"
"John Kerry raised  #36;2 million for Democrats in just a few hours Saturday, making two stops in this understated and elegant vacation destination for the Northeastern well-to-do. Habibullah Abdul Ghafar is drinking black tea and resting after arriving in Canada from Kyrgyzstan, the Central Asian country where he and his family were stranded as refugees.","en","news"
"helping lift shares but  leaving most financial markets trading in narrow ranges after  sharp reactions in previous sessions. Update 1: Heinz 1Q Profits Are Down, but Sales Climb HJ Heinz Co. the maker of ketchup and other foods, reported its first-quarter earnings fell 9 percent from results a year ago when its profits were boosted by the sale of some of its businesses to Del Monte.","en","news"
"the companies plan to announce on Monday. Software Companies Not Liable for Copyright Infringement Description: A federal appeals court on Thursday ruled that companies that provide software that runs two Internet-based file-sharing networks are not liable for copyright infringement by people who use the networks to share music and movies.","en","news"
"com for \$72M Amazon. com Inc. said Thursday it has agreed to buy Joyo. com Ltd. China's largest online retailer of books, music and videos, for \$72 million. Nortel Networks to Eliminate 3, or 10 percent, as it struggles to recover from an accounting scandal that toppled three top executives and led to a criminal investigation and lawsuits.","en","news"
"Eolas sounded an upbeat note Thursday. Apple Powerbook G4 Batteries Recalled Thousands of rechargeable batteries for use in Apple #39;s Powerbook G4 laptop are being recalled. The batteries can overheat, posing a fire hazard. However, no injuries have been reported. One, two, er, too many Researchers claim to have solved the mystery of the people who simply do not count.","en","news"
"US Women Wrap Up Softball Gold The US women #39;s softball team has finished a dominating performance at the Olympics by capturing the gold medal. The Americans had little trouble with Australia in the final Monday, cruising to a 5-1 victory. China, Japan, Ukraine Take Women #39;s Wrestling Golds China #39;s Wang Xu captured gold in the 72-kilogram category,","en","news"
"First fight, that is, unless you understand what it took for him. Michael Phelps, one gold won but one of  his eight title chances now lost, takes on Ian Thorpe and  Pieter van den Hoogenband in their long-awaited showdown in the  200 meters freestyle final on Monday. The Minnesota Twins left Cleveland clinging to first place in the AL Central  #151; and already looking ahead to their next showdown with the surprising Indians.","en","news"
"As the peace deal for Najaf unraveled, militants bombarded a police station with mortar rounds, killing seven police and injuring 31 others. A closely watched measure of future economic activity fell in July for the second consecutive month, reinforcing evidence that the nation's financial recovery is slackening. The Conference Board said Thursday its Composite Index of Leading Economic Indicators dropped by 0.","en","news"
"Germany, for four of seven US soldiers charged in the Iraqi prisoner abuse scandal that took place at Abu Ghraib prison outside of Baghdad. China's Ministry of Agriculture confirmed that a deadly strain of bird flu was found in pigs last year, the Xinhua news agency reported. Kenya Maasai land tensions grow Police in Kenya shoot dead an elderly Maasai tribesman who tried to graze cattle as part of a colonial land dispute.","en","news"
"Schroder adopts Russian orphan Three-year-old Victoria, from St Petersburg, has been living at the Schroders #39; family home in Hanover in northern Germany for several weeks. Keep talking, Downer urges N Korea Australia #39;s foreign minister pressed leaders in North Korea yesterday to remain involved in six-nation talks on its nuclear program,","en","news"
"American Patterson overcomes Russian for all-around Olympic title The 20-year wait is over. America has its new Mary Lou, and her name is Carly Patterson. The 16-year-old dynamo beat Russian superstar Svetlana Khorkina to give the United States another Olympic all-around champion Thursday night, closing with a dazzling. A new generation of US sprinters take their marks As track and field begins at the Games,","en","news"
"Jim Thome and Bobby Abreu homered and Eric Milton pitched seven solid innings as Philadelphia ended a seven-game losing streak with a 4-2 victory over the Milwaukee Brewers on Friday night. Top-seeded Lindsay Davenport cruised past seventh-seeded Flavia Pennetta 6-2, Ortiz Stifle Yankees Ramon Ortiz pitched four-hit ball for eight stellar innings to lead the Anaheim Angels over the Yankees.","en","news"
"alarming and infuriating French politicians and Jewish leaders who are struggling to halt an epidemic of anti-Semitic incidents across France. Somalians sworn in NAIROBI International mediators swore in members of Somalia #39;s new Parliament on Sunday, a move seen as a crucial step toward establishing the first central government in the country since 1991.","en","news"
"Vieira Looks to Golden Future with Gunners Captain Patrick Vieira predicted a terrific future at Arsenal as the club moved within touching distance of setting a new unbeaten league record. Silver glint of a glowing future Silver for the women #39;s quad yesterday sealed Britain #39;s biggest Olympic rowing tally since 1928,","en","news"
"Battling Robots in Japan's Pop-Culture Tech The ring sits in the spotlight of a tense, packed auditorium and the jittery fighters await the bell at their red and blue corners. Like any fight, there's always the danger of a punishing uppercut or left hook. But these boxers have even more worries  like battery failure and software bugs.","en","news"
"The new release is based on version 1. the most recent version of the Mozilla internet application suite. Attachmate Heightens Security, Centralises Management and Brings Microsoft Usability to Host Access with EXTRA! Specialist in productivity-enhancing host access, Attachmate, today announces the launch of  #39;next generation #39; emulation with EXTRA! Mainframe Server Edition version 8.","en","news"
"the Google Guys, is now not only available on newsstands all over the country, but also on the Security Exchange Commission's website because of a possible SEC violation. Now, it will be more difficult. RealNetworks today is slashing the price of a digital download to 49 cents a song from 99 cents - a bold move in the war over digital music.","en","news"
"Finnish Students Rank #1 in the World Which country has the smartest students in the world? According to a study conducted by the Organization for Economic Co-Operation and Development, pupils in Finland tested higher than those in any other country. Radical Shiite Muslim cleric Muqtada al-Sadr, whose militia has been fighting American and Iraqi forces for almost two weeks in Najaf,","en","news"
"one week before a scheduled vote to replace him. China has executed a university dropout for killing six men - four of whom had raped him, state media reported on Sunday. Malaysia Teenager in Hospital for Bird Flu Checks A teenager from the village at the center of a bird flu outbreak has been hospitalized with cold symptoms,","en","news"
"Lisa Fernandez pitched a three-hitter Sunday and Crystl Bustos drove in two runs as the Americans rolled to their eighth shutout in eight days, putting them into the gold medal game. U. S. warplanes bombed Najaf's Old City and troops clashed with Shiite militiamen Sunday amid fears a plan to end the standoff could collapse.","en","news"
"The U. S. Securities and Exchange\Commission barred U. S. mutual funds on Wednesday from\channeling brokerage commissions toward Wall Street firms based\on their promotion of the funds' shares. Google Inc. slashed the size of its  closely watched initial public offering nearly in half to less  than \$2 billion on Wednesday, splashing cold water on what has  been touted as the hottest Internet IPO in years.","en","news"
"Andy Pettitte #39;s first year as a non-Yankee ended yesterday in appropriately depressing fashion: His team was here at Citizens Bank Park, and he was back home in Houston, preparing for season-ending surgery. NCAA champion Ryan Moore and Canadian James Allenby were among 32 golfers who advanced with match-play victories Wednesday at the US Amateur.","en","news"
"Paul Hamm thought his night was over. Hansen has an uphill struggle for breaststroke bronze ATHENS, Greece  Brendan Hansen is the swimmer who caught a wave and then lost it. He owns two world records and zero gold medals. Aaron Rowand homered twice  #151; including his first career grand slam  #151; and Jose Contreras won his third straight decision for Chicago in the White Sox's 9-2 victory over the Detroit Tigers on Wednesday night.","en","news"
"the government said on Tuesday in a report\showing inflation pressures largely in check. Deere   Co. (DE. N), one of the world's\largest farm equipment makers, on Tuesday said quarterly\earnings jumped sharply, driven in part by strength in its\agricultural and construction equipment businesses. BJ's Wholesale Club Inc. said Tuesday that sales growth boosted second-quarter earnings 25 percent,","en","news"
"Benchmark indexes pared gains as oil prices. Australia #39;s Pacific Hydro FY04 Net A\$40. Up 39 CANBERRA (Dow Jones)--Renewable energy generator Pacific Hydro Ltd. (PHY. AU) reported Wednesday a 39 jump in net profit, including a one-time tax benefit, to A\$40. up from A\$29. Warehouse offers cut-price coffins A US discount warehouse chain known for piling  #39;em high,","en","news"
"the Dalai Lama, fled his homeland on horseback as Chinese shells rained down on his capital. Burundian rebels: we #39;re ready to defend ourselves in court in &lt;b&gt;. &lt;/b&gt; Leaders of a Burundian rebel group said Friday they were ready to defend themselves in an international court against war crimes charges after they took responsibility for the massacre of 163 refugees,","en","news"
"Lithuania Upsets the United States The U. S. men's basketball team lost to Lithuania, today at the Olympic Games. Ulmer breaks world record in qualifying New Zealand #39;s Sarah Ulmer dealt her rivals a heavy psychogical blow today, reclaiming her individual pursuit world record in magnificent fashion at a sweltering Olympic Velodrome here today.","en","news"
"who has been in US military detention for almost three years. Tanks close in on sacred shrine as US launches fresh assault on &lt;b&gt;. &lt;/b&gt; US forces renewed their assault yesterday on Mehdi Army positions in and around Najaf #39;s old city with an early morning bombing raid and an advance which brought tanks at some points","en","news"
"but Bush seems to have gained the upper hand as Kerry's military past comes under attack. Violence erupts following Bangladesh attack Sporadic violence has erupted in Bangladesh in response to a deadly grenade attack on an opposition rally, which killed at least 19 people and wounded more than 100. Calling the shots KATHMANDU,","en","news"
"Halliburton Now Says It Will Not Get Extension From Army The company said today that the United States Army had decided not to grant it additional time to substantiate its costs in Iraq and Kuwait. Time is running out for prospective investors to submit their offers to buy shares of Google Inc.","en","news"
"(YHOO) in a settlement that removes a legal threat hanging over its IPO at the expense of enriching a nettlesome rival. If you're planning on attending this month's Olympic Games, you'd best be careful what you say and do in public. Software will be watching and listening. After a recent legal setback,","en","news"
"unit and Deutsche Bank AG cleared a plan that gives them most of the company #39;s equity when the carrier emerges from bankruptcy protection at the end of September. U. S. stocks ended higher for a third  successive day on Tuesday, even as oil prices rose to another  record, after investors were encouraged by data showing an  easing of inflationary pressure and a sharp rebound in the  housing market.","en","news"
"a lot of its citizens are still feeling worse off. The article explains the results of a 40 year panel study which has shown that although mean incomes have increased, income variability has increased massively, causing many Americans to feel less well off, despite the growing economy. The Great K5 Limerick Contest Queue submissions being scarce,","en","news"
"the Transportation Department said. Freddie Mac Receives Notice That It May Face Action by SEC Freddie Mac, the government-chartered mortgage company that restated earnings by \$5 billion, said yesterday that it might be the subject of a civil lawsuit by the Securities and Exchange Commission. Halliburton #39;s shares closed higher Wednesday after the Army Materiel Command reversed its decision to withhold 15 percent of its future payments to the company under a contract to supply and support US troops in Iraq.","en","news"
"quot; authorities announced. Stung by criticism about its role in fighting terrorism, Saudi Arabia has launched a radio advertising campaign in 19 U. S. cities citing the Sept. Omar Garcia Escobedo's family thought their 25-year-old son had, like so many other migrants seeking work in the United States, drowned trying to cross the treacherous,","en","news"
"delegates said. Cubans hit hard by hurricane Charley will receive  #36;50, S. assistance, the State Department said Friday. The German government said on Tuesday  U. S. plans to pull out 30, but communities hit by the decision  warned they were headed for economic disaster. Top American sprinters Jason Lezak and Ian Crocker missed the cut in the Olympic 100-meter freestyle preliminaries Tuesday,","en","news"
"Reserve forward Toni Nhleko knocked in a header one minute into stoppage time, leading the Dallas Burn to a 1-0 victory over the first-place MetroStars on Sunday. Tiger Woods came up empty in a major again, but he's still the No. Longtime Tennessee Tech women's basketball coach Bill Worrell has agreed to a new three-year contract with the option for three more years,","en","news"
"as Greece  counted the cost of the Games in national pride and cash. U. S. Wins Sailing Gold Americans Paul Foerster and Kevin Burnham win their first Olympic titles after outmaneuvering their British rivals during the final 470 class race. Equestrian Medal Overturned France is awarded the gold medal in the three-day equestrian team event after winning an appeal with Britain and the United States against an earlier decision that gave the victory to Germany.","en","news"
"but those problems were easy to ignore Tuesday night, thanks in part to Steve Finley. Agassi Opens With A Win In Washington No. Welcome change for Cabrera Let's say Boston is the sun of the baseball universe, where hope and criticism burn bright, where a city revolves around the game.","en","news"
"Stronach mum on Tobin Auto parts magnate Frank Stronach offered few details Monday on the circumstances leading up to Brian Tobin #39;s sudden departure from two of his companies, refusing to comment on reports of friction between the two. High-flying oil prices eased for a  second session on Monday as Iraq resumed exports from both its  northern and southern outlets after lengthy disruption,","en","news"
"Apple (Nasdaq: AAPL) was outraged when RealNetworks (Nasdaq: RNWK) first announced its intentions to go after its iTunes and iPod market share. It should not have been: Its customers, apparently, are more than willing to go to bat for Apple. A California condor chick that was part of an ambitious breeding program was found dead near its nest,","en","news"
"raised \$1. The yen kept most gains against the  dollar on Thursday after rallying to a four-week peak, but  investors saw no reason to push it higher due to growing  uncertainty about the outlook for the Japanese economy. U. S. shoppers have kept a tight grip  on their wallets this holiday season with indices on Tuesday  showing sluggish sales in the second week of the  season.","en","news"
"US May Support Duplicate Gold for Korea in Olympic Gymnastics The US Olympic Committee said it may support a duplicate gold medal in the men #39;s all-around gymnastics event, as South Korea said it would seek to overturn the scores that gave the title to American Paul Hamm. Olympics: Soldier Shot Dead,","en","news"
"Flash Video Takes a Front Seat Macromedia announced a new kit that simplifies the way professional developers add video to their Web sites. Microsoft Integration Server on Deck Microsoft (Quote, Chart) is ready to ship Host Integration Server 2004, offering a Windows interface to mainframes and legacy applications. This is how serious the competition for digital music customers has become:","en","news"
"Spain. Redemption came from the perfect spot - the 3-point line - for Sarunas Jasikevicius. The Lithuanian guard, whose off-target 3-pointer kept his team from pulling off the biggest upset of the Sydney Olympics, didn't miss when it counted Saturday night against the Americans in a thrilling 94-90 victory. Pakistan foils al-Qaeda attacks PAKISTANI security agencies have arrested nearly a dozen al-Qaeda-linked terror suspects who allegedly plotted to attack key sites including military headquarters,","en","news"
"dies aged 82. The way was clear for Pakistan's Finance Minister Shaukat Aziz to become prime minister after unofficial results showed he had secured a seat in parliament's lower house by winning two by-elections. Israeli PM defies party rebellion Israel's Ariel Sharon says he will push ahead with plans for Gaza disengagement,","en","news"
"Reporting to Work Mid-Flight Business travelers will soon take advantage of airborne internet if two companies have their way. Boeing and software maker iPass plan to use satellite and Wi-Fi to connect high fliers to the office. Venezuelan Vote Audit Backs Chavez, Finds No Fraud An audit of Venezuela #39;s referendum results has confirmed President Hugo Chavez won the poll fairly and found no evidence to support the opposition #39;s claims","en","news"
"Chicago White Sox manager Ozzie Guillen was suspended Monday for two games and fined an undisclosed amount for arguing with umpires during an Aug. The trial in the Kobe Bryant rape  case looked set to go ahead later this month after the state's  highest court ruled against prosecutors on Monday over a key  piece of evidence in the high-profile case.","en","news"
"China Detains Prominent Buddhist Leader Chinese authorities detained a prominent, U. S. -based Buddhist leader in connection with his plans to reopen an ancient temple complex in the Chinese province of Inner Mongolia last week and have forced dozens of his American followers to leave the region, local officials said Wednesday.","en","news"
"Regulators investigating Fannie  Mae's accounting practices have sent subpoenas to the No. S. mortgage finance company in connection with the probe, a  source familiar with the matter said on Friday. Media conglomerate Viacom Inc. \(VIAb. N) is considering expanding into the video game business\and could acquire publisher Midway Games Inc.","en","news"
"Mars Rover Finds Mysterious Rocks and More Signs of Water ith one Mars rover climbing into the hills and the other descending deep into a crater, scientists yesterday reported the discovery of several mysterious rock structures along with yet more signs that Mars was once awash in water. Microsoft previews 64-bit XP,","en","news"
"Also: TiVo goes all out to attract customers   hellip;. Sprint offers service guarantees for business wireless subscribers   hellip;. and more. A Personal Operator From Verizon Verizon plans to offer a service that would act as a virtual switchboard operator, letting customers stay in touch at all times. The program would send phone calls,","en","news"
"Specifically, the filing asks the US District Court to order judgment in favor. HP decries Itanium, SAP issues and bad English &lt;strong&gt;HP World&lt;/strong&gt; Execs try to respond Researcher Finds Flaws in XP SP2 German research firm Heise Security has issued an advisory for a pair of security flaws in Microsoft #39;s (Quote,","en","news"
"Reversal Gives Peirsol Gold; Phelps Wins 200 IM Despite being disqualified shortly after his final, Aaron Peirsol was eventually reinstated as the winner of the 200-meter backstroke event. Mets Open Doubleheader With Victory Mike Cameron homered and drove in four runs, and Kris Benson pitched six solid innings to lead the Mets past Colorado.","en","news"
"Forget the medal count, Phelps has far exceeded expectations Two-time US Olympian Tom Dolan, who took back-to-back gold medals in the 400 IM at Atlanta and Sydney, will analyze races for SI. com throughout the Games. On a day on which both Greece and the Olympics celebrated themselves by returning the Games to their ancient home in Olympia,","en","news"
"Lycoris 1. Following a deal with software developer CodeWeavers in June, Window-to-Linux software has been integrated with Lycoris #39;. Eolas patent on Web plug-in technology rejected The controversial Eolas Technologies patent looks like it is about to be rescinded by the US Patent Office. The office has confirmed that it has rejected all of the 10 patent claims that it re-examined.","en","news"
"Eta. Michael Phelps doesn't mind making history while sitting in the stands. The man who dominated the attention at the Olympic pool gave up a coveted spot on the 400-meter medley relay team to Ian Crocker. A series of bombs exploded at an opposition rally in the Bangladesh capital Saturday,","en","news"
"while hundreds of people sought refuge in shelters. The state attorney general's office has concluded that Michael Jackson was not ""manhandled"" by sheriff's deputies who took him into custody last year on child molestation charges, CBS News reported Sunday. The findings were contained in a three-page letter Martin A. High-level New Jersey Democrats said Sunday that pressure is building among members of Gov.","en","news"
"Sri Lanka hit by oil strike Workers at Sri Lanka's main oil company end a two-day strike, held in protest at government plans to sell more of the company. Kmart Holding Corp. (KMRT. O) on Monday\reported its third consecutive quarterly profit as cost cuts\made up for slumping sales, and its cash pile grew to about\ #36;2.","en","news"
"Malaysia sets up sanctuary in Terengganu to protect endangered turtles TERENGGANU: Malaysia has gazetted 60 hectares of land off the east coast state of Terengganu to help conserve the dwindling number of endangered sea turtles. In another blow to Microsoft, a government agency in New South Wales, Australia, signs a deal with Sun to migrate 1,","en","news"
"raising \$1. Qantas profits soared to a record 648. euro 376 million) in the past fiscal year, thanks to rising passenger numbers despite fears of Iraq war-related terrorism and the aftermath of. The Army has abruptly reversed itself and decided to pay all of Halliburton Co. #39;s fees to house and feed US troops in Iraq and Kuwait after the company threatened to legally challenge the effort to penalize it.","en","news"
"the Atari 2600 and Intellivision are respected gaming platforms, and the men and women who created titles such as Centipede and High-Speed Users Move Into Majority Web users with fast broadband connections have finally muscled aside dial-up users to form a majority of the American Internet population, according to Nielsen/Net Ratings.","en","news"
"Bahrain boils in summer power cut Bahrainis swelter in 50-degree temperatures without air conditioning as a fault cuts electricity across the island. British Foreign Secretary Jack Straw left London for Sudan, where he was to discuss the crisis in war-torn Darfur with President Omar al-Beshir and senior officials. Relatives of 12 Nepalese workers missing in Iraq were desperately seeking information after an Islamist website showed alleged pictures of them in captivity.","en","news"
