"text","language","style"
"but the rare admission appeared to be aimed more at deflecting criticism about his corrupt government than making real changes. In a decade at the helm of the Palestinian Authority, Arafat has resisted attempts to get him to fight official corruption, reform the security services and relinquish some of his near-absolute powers.","en","news"
"Bill Simmons I #39;m starting to wonder if  quot;Puerto Rico 92, USA 73 quot; was one of those life-altering upsets, along the lines of  quot;USA 4, USSR 3 quot; and  quot;Cadwallader 99, Nevada State 98. quot; It #39;s not that we lost. I knew that was going to happen. Even predicted it.","en","news"
"and its WebSphere offerings, Microsoft Corp. on Tuesday announced imminent availability of Host Integration Server 2004. RealNetworks Inc. is taking on Apple Computer #39;s wildly successful iTunes Music Store with a half-price sale offering music downloads for 49 cents a song. Microsoft Delays Windows XP SP2 for Home Users Microsoft has delayed the rollout of XP Service Pack Two (SP2) for home users,","en","news"
"officials said. Guantanamo alert for terror hearings GUANTANAMO BAY US NAVAL BASE: US military authorities yesterday defended the special trials for war on terror detainees that start this week as they stepped up security at the Guantanamo Bay base in Cuba for the hearings. Somalia swears in new MPs SOMALIA,","en","news"
"Mark Calcavecchia briefly took the lead Friday before a double bogey left him one stroke behind leader Roland Thatcher after the first round of the rain-delayed Reno-Tahoe Open. Conference USA athletic directors have voted unanimously to recommend holding the league's inaugural football championship game in 2005. Greece looks set to lose the first medal it won at the Athens Olympics after bronze-winning weightlifter Leonidas Sampanis failed a drugs test.","en","news"
"or five races -- away. Mistakes Are Abundant Missed tackles, penalties and other assorted errors marked Maryland's intrasquad scrimmage Saturday, a dire portent of another slow start. Cink Excels at NEC Stewart Cink used a 2-under 68 on Saturday to extend his lead at the NEC Invitational to five shots while Tiger Woods and David Toms faded.","en","news"
"More than 10 months after moving  boldly to boost the power of U. S. shareholders in choosing  corporate directors, the Securities and Exchange Commission has  become mired in disagreement. U. S. Treasury prices edged lower on  Friday as oil prices retreated from record highs, but trading  was thin as a dearth of data prompted many investors to take  off for an early weekend.","en","news"
"Or a hotel that can detect when a room is vacant, and turn off the heating or cooling systems in that room to save energy. Web Surfers Hit Higher Speeds The majority of Internet users in the U. S. have ditched dial-up, survey says. You Perform. \\With hundreds of millions of users around the world,","en","news"
"Rough seas killed five fishermen in Taiwan and two children in Japan, officials said. Two outer walls are cracked and crumbling, the bathroom walls have fallen down in a heap of brick, the steps to the second floor wiggle like loose teeth. Groundwater seeps into a little courtyard to form an unwanted wading pool.","en","news"
"African leaders on Wednesday declared  quot;a terrorist organisation quot; the rebels who claimed the slaughter of at least 160 Congolese Tutsi refugees in Burundi, but failed to impose sanctions on their group. Hiram L. Fong, a son of immigrants who overcame poverty to become a millionaire businessman and the first Asian-American elected to the U.","en","news"
"Dutch arrest in Iraq genocide case A 62-year-old Dutchman will be charged for war crimes and as an accomplice to genocide for supplying lethal chemicals to Saddam Hussein #39;s regime, prosecutors said Tuesday. A journalist who commanded a boat\alongside John Kerry in Vietnam broke a 35-year silence on\Saturday and defended the Democratic presidential candidate\against Republican critics of his military service and\integrity.","en","news"
"protesting against the massacre of at least 160 Congolese Tutsis at a United Nations refugee camp in the west of the country. Police defused a bomb in a town near Prime Minister Silvio Berlusconi's villa on the island of Sardinia on Wednesday shortly after British Prime Minister Tony Blair finished a visit there with the Italian leader.","en","news"
"offsetting a positive outlook from computer maker\Dell Inc. (DELL. O) Assets of the nation's retail money market mutual funds fell by  #36;1. the Investment Company Institute said Thursday. Retail sales bounced back a bit in July, and new claims for jobless benefits fell last week, the government said Thursday, indicating the economy is improving from a midsummer slump.","en","news"
"FBI interviews and surveillance of at least a dozen political activists in Kansas and Missouri prior to the Democratic National Convention amounted to intimidation, contends the American Civil Liberties Union. Sadr caves in to avoid assault THE radical cleric Muqtada al Sadr yesterday demonstrated once again his aptitude for self-preservation when he appeared to blink first in the stand-off with Iraqi and US forces in Najaf.","en","news"
"An 8-year-old girl who suffers from a rare digestive disorder and cannot eat wheat has had her first Holy Communion declared invalid because the wafer contained no wheat, violating Roman Catholic doctrine. An aide to radical Shiite cleric Muqtada al-Sadr said the militant leader instructed his followers late Thursday to turn over the keys of the revered Shiite shrine they were hiding in to top religious.","en","news"
"won by Thorpe. Consumer prices, which have been buffeted this year by soaring energy costs, fell by 0. the government reported Tuesday. The Labor Department said the decline in its closely watched Consumer Price Index was the first decrease since a 0. a decline which also reflected a decline in energy costs.","en","news"
"MSBlast suspect pleads guilty The 19-year-old faces up to 37 months in prison after admitting to creating the ""MSBlast. B"" variant. Microsoft plugs hole in Exchange The patch fixes a flaw in the e-mail server software that could be used to get access to in-boxes and information. PC security under fire A vulnerability in AOL's instant messenger could allow attacks.","en","news"
"and three Americans who failed to match that style are out of the Olympics. The US women #39;s basketball team continued its impressive play at the Olympics, pulling away from previously-unbeaten Spain for a 71-58 victory on Friday. The unbeaten U. S. women's basketball  team had their sternest test of the Olympic tournament so far  Friday,","en","news"
"After 38 Years, Valenti Prepares To Move On Jack Valenti took a break from cleaning out his office the other day to expound on a subject he knows well: the art of persuasion. Over minestrone soup and hummus at his usual table at the restaurant in the Hay Adams Hotel,","en","news"
"Australia's Jodie Henry armed herself  with a world record while Michael Phelps targeted his fourth  Olympic gold medal backed by a Games record in qualifying for  Thursday's finals. Hamm Wins Gold for U. S. Paul Hamm of the United States won the gold medal Wednesday in all-around gymnastics. U-Va. 's Brooks Out Linebacker Ahmad Brooks missed his second practice after getting into an argument with Cavs Coach Al Groh during Monday's session.","en","news"
"analysis, reporting, data integration and management tools into a standalone application. Mozilla Sparks New Fire with Thunderbird E-Mail Client Thunderbird is touting its new features, like RSS news and blog reader integration into its e-mail client. Users can scan and sort through hundreds of headlines. In an announcement made around the midnight hour earlier this morning,","en","news"
"\specialty apparel retailer, on Thursday reported a 7 percent\decline in quarterly profit, meeting lowered forecasts, after\summer clearance sales drew surprisingly small crowds. Nortel Networks Corp. said Thursday it will slash its workforce by 3, or 10 percent, as it struggles to recover from an accounting scandal that toppled three top executives and led to a criminal investigation and lawsuits.","en","news"
"Spirit, while its twin, Opportunity, observed the deep crater it climbed into two months. Compuware asks court to sanction IBM An emergency motion was filed Friday the 13th of August in US District Court of Eastern Michigan, Compuware said that IBM failed to provide essential evidence, which includes several pieces of disputed software source code,","en","news"
"Hamid Karzai was sworn in as  Afghanistan's first popularly elected president Tuesday, promising to bring peace to the war-torn nation and end the  economy's dependence on narcotics. Four Palestinian militants and an Israeli  soldier were killed Tuesday in the heaviest Gaza fighting since  Yasser Arafat's death, raising the prospect that renewed  violence could complicate a vote for his successor.","en","news"
"the first decline since late last year -- on a drop in gasoline prices, the US Department of Labour said yesterday in a report that suggests underlying price pressures in the world #39;s biggest. Merrill survey of fund managers finds them more pessimistic, risk averse Global fund managers have become increasingly risk averse and significantly more pessimistic about corporate profits and the US stock market,","en","news"
"Clashes between police and opposition  supporters erupted across Bangladesh on Sunday in the aftermath  of grenade attacks on a rally that killed 17. Iconic Munch Painting Stolen from Museum in Norway Edvard Munch's paintings ""The Scream"" and ""Madonna"" were stolen from an art museum Sunday while armed men threatened the staff at gunpoint.","en","news"
"Bernie Ecclestone has attempted to shrug off Monday #39;s court ruling, which found in favour of the three banks holding a 75 per cent stake in Formula One, by making a substantial cash offer to the sport #39;s ten teams in an attempt to prevent a breakaway series Games Rock Athens,","en","news"
"In Google's Auction, It's Not Easy to Tell a Bid From a Bet In a competition combining suspense and strategy, countless brave souls are hoping to buy a small piece of Google in an auction this week. Tokyo's Nikkei average fell 0. clouding  the outlook for the global economy. Exporters led a fall in Asian shares  on Monday as oil prices set new highs near \$47 and data showing  the U.","en","news"
"a stone used for foot cleansing and wall carvings telling the story of the biblical preacher. A dozen blind students from across the United States are at a summer camp this week working on a project most don't associate with the visually impaired  #151; launching a NASA rocket. Many engineers lack even a four-year degree About 40 percent of U.","en","news"
"CRIENGLISH. com said Wednesday. Tim Hudson pitched a five-hitter to earn his first victory since June 11, and Scott Hatteberg's second grand slam of the season highlighted a four-homer attack that carried the Oakland Athletics past the Baltimore Orioles 11-0 Tuesday night. Dodging Another Upset, U. S. Holds Off Greece Nobody heard the American players exhale when the buzzer sounded to end a 77-71 victory,","en","news"
"Air Canada #39;s creditors overwhelming endorsed the airline #39;s new business plan during a meeting at a Montreal hotel Tuesday. Don't Marry Until March Plan a big, fat cheap wedding, and start your coupling with extra cash, not debt. Outback Steakhouse Inc. said Tuesday it lost about 130 operating days and up to \$2 million in revenue because it had to close some restaurants in the South due to Hurricane Charley.","en","news"
"staining them pink will do just fine. The Call Is Cheap. The Wiretap Is Extra. Wiretapping Internet phones to monitor criminals and terrorists is costly and complex, and potentially a big burden on new businesses trying to sell the phone service. Google Is One for the Books, Leaving Some With Regrets Top Silicon Valley venture capitalists who missed out on the Google deal are scratching their heads.","en","news"
"Berths in Semifinals for Two Americans On aqua-colored walls and giant blue columns, Patricia Miranda saw all she needed to see. The message was written in white inside Ano Liossia Olympic Hall, even next to the wrestling mats in case anyone forgot. Moore battles back to top List at US amateur championship Ryan Moore staged a remarkable comeback to overhaul Luke List in the 36-hole final of the US amateur championship at the Winged Foot Golf Club on Sunday.","en","news"
"putting his plan for a staged withdrawal of settlers from the West. who is holed up with his fighters in the holy city of Najaf - was notable for one thing: the lack of a deadline. Opp will be taken along on all issues: Shaukat ISLAMABAD: Newly elected member of the National Assembly and prime minister-designate,","en","news"
"The territory could be a perfect staging ground for Osama bin Laden's militants, with homegrown rebel groups, drug and people smugglers, and corrupt governments. Chemical may cause muscle disease Scientists say a defect in a key protein may cause the muscle-wasting disease muscular dystrophy. Concerns mount for reporters missing in Iraq A freelance Italian journalist who had been working in the troubled Iraqi city of Najaf is missing and his driver has reportedly been killed,","en","news"
"com offering telephone and other data sources including direct links (labeled ""professional profile"") to the Eliyon. com database. Eliyon aggregates data from a variety of open web sources. Be careful as some of these profiles might contain old, outdated info. \\The. FaganFinder Search Engine Launches URLinfo FaganFinder Search Engine Launches URLinfo\\Another great tool from Michael Fagan via his already VERY useful Fagan Finder search page.","en","news"
"and you've just raised roughly \$1. What are you going to do now? Moveon. org subscribers exposed Dozens of the political action committee's subscriber pages revealed by simple Google search. IE Flaw Affects Windows XP SP2 Systems The  quot;highly criticial quot; vulnerability affects Internet Explorer 5. and 6 on fully patched PCs running either Windows XP SP1 or the newer SP2.","en","news"
"sidestepping U. S. regulators' objections\to imported drugs, Gov. Rod Blagojevich said on Tuesday. Chavez lambasts fraud allegations Venezuelan leader Hugo Chavez rounds on opponents for alleging fraud in a referendum he seems to have won. An Iraqi peace delegation has urged a radical Shi #39;ite cleric to call off his uprising in the city of Najaf,","en","news"
"Nestle #39;s 1st Half Net Profit Hits \$2. the world #39;s biggest food and drink company, on Wednesday posted a first-half net profit of 2. up 0. Higher raw material costs and lower ice\cream sales in Europe ate into Nestle's (NESN. VX) first-half\results, sending shares in the world's largest food group down\over five percent on Wednesday amid concerns about its\long-term profitability.","en","news"
"Democrat John\Kerry asked the Federal Election Commission on Friday to force\a group accused of collaborating with the Bush campaign to\withdraw ads challenging his service in Vietnam as the\presidential race took a decidedly bitter turn. Reform Advocates in China Hope for a Birthday Present The Communist Party is using the 100th anniversary of Deng Xiaoping's birthday to emphasize the urgency of overhauling the one-party political system.","en","news"
"the world's second largest handset maker. Weather gets 3D gaming makeover BBC weather is to use 3D gaming graphics technology to make its bulletins more realistic and accurate. Exorcist movie thrills box office A new prequel to The Exorcist was the most popular film at North American cinemas at the weekend,","en","news"
"the first senior suspect to surrender under\a one-month government amnesty announced last week. ""\\""Othman Al-Omari, number 19 on Saudi Arabia's most wanted list of 26, accepted\King Fahd's offer of amnesty, which was made last week, according to Saudi\sources Monday. ""\\""Al-Omari, who turned himself in on Sunday night, was a business partner of\Shaban Al Shihri -- the first al Qaeda member to accept the offer when he turned\himself in Friday.","en","news"
"The Australian women and American men ended the swimming competition at the Athens 2004 Olympics Games in style Saturday, both breaking world records in the 4x100 meter medley relays. Dolphins on verge of trading Ogunleye to Bears The Miami Dolphins have agreed to trade defensive end Adewale Ogunleye to the Chicago Bears for wide receiver Marty Booker and a 2005 third-round pick,","en","news"
"Dell Cuts Prices on Enterprise Hardware Dell has cut prices on a number of products geared to enterprises. The PowerEdge 4600 dual-processor server price tag has been trimmed by about 22 percent, now starting as low as \$4, it works #39;  quot;As more and more retailers try to cash in on the online music scene,","en","news"
"but the injury isn't considered serious. Houston starting pitcher  Roger Clemens left Wednesday's 9-8 win over Philadelphia with a  strained right calf. After playing second fiddle at the last two World Championships, Georgia #39;s Zurab Zviadauri finally shook off his choker tag. So far this year, Haiti has endured an armed insurrection that killed 300 people and toppled a president,","en","news"
"OmniWeb browser takes aim at minority Mac market SUCH an embarrassment of riches. Apple Macintosh users have two new web browsers to choose from. It #39;s a curious market. All Macs come with two free browsers: Microsoft #39;s Internet Explorer 5. and Apple #39;s own slick and elegant Safari. Wireless Solution Illustrates Success of Unorthodox Strategies Wall Street helped Aether Systems Inc.","en","news"
"Apple G5 chips scarce Apple Computer may be facing greater difficulties than previously thought in getting hold of chips to power its high-end personal computers. Dual-Format Disc That Plays Both HD DVD and DVD Memory-Tech and Toshiba today announced that they have developed a dual-layer ROM (read-only) disc that can store content in both the HD DVD and DVD formats.","en","news"
"MCI and other telephone companies that provide local calling by renting other carriers #39; equipment have received a six-month extension on discounted leasing rates while regulators work on new competition rules. Fresh sign of housing market cooling House prices in England and Wales fell slightly in August, property research company Hometrack says,","en","news"
"Brit relay teams go through Britain's men's and women's relay teams qualify for their  4x100m medley finals. Steroid scandal will be given lip service Do you assume this raging scandal will be enough to overhaul Major League Baseball #39;s laughable drug policy? If so, you must think Bill Clinton didn #39;t have sex with that woman.","en","news"
"ending a tumultuous\process beset by poor market conditions and a series of\missteps. Rush for free mobile connections Islamabad, Aug. Tens of thousands of Pakistanis endured hours of stifling heat this week to accept an offer of free mobile phone connections, a sign of the pent-up demand in a country where cellphone usage has remained low.","en","news"
"High foreign ownership of US debt is  quot;a healthy situation quot; and the dollar will remain the world #39;s preferred reserve currency, Treasury Secretary John Snow said on Friday. Walk the hilly campus of Soka University of America in Aliso Viejo, Calif. and you enter the fabulous world of the international nonprofit.","en","news"
"which will Suspected mercenaries on trial in Equatorial Guinea A trial is underway for 14 suspected mercenaries accused of plotting to topple the Government of Equatorial Guinea, an oil-rich country in west Africa. Australian Terrorist Suspect Hicks Faces US Military Tribunal David Hicks, an Australian charged with training with al-Qaeda,","en","news"
"Yields on U. S. Treasuries held near\recent lows on Friday as oil topped  #36;49 a barrel, threatening\the outlook for both the economy and stocks. Oil prices raced to fresh highs on  Friday, carrying U. S. crude over \$49 a barrel, driven by  escalating violence in Iraq and unabated fuel demand growth  from China and India.","en","news"
"Chipper Jones cracked two homers and  Julio Franco's two-run double in the seventh inning drove in  the winning runs as the streaking Atlanta Braves downed the St. Louis Cardinals 9-7 in the National League Saturday. The honor of Greece lies above  individual athletes and no backstage antics should compromise  it,","en","news"
"S. airlines have agreed to limit  flights into Chicago's O'Hare International Airport to 88  arrivals per hour between 7 a. m. and 8 p. m. in an effort to cut  congestion that has slowed the whole U. S. aviation system, federal officials said on Wednesday. FAA: Flight-Reduction Deal Set for O #39;Hare WASHINGTON Aug.","en","news"
"an unexpected first casualty of President Roh Moo-hyun #39;s call for an inquiry into who benefited from working with Korea #39;s Japanese colonial rulers. Current Federal Finance Minister, Mr. Shaukat Aziz won by-election on his way to officially becoming Prime Minister of Pakistan. As a member of ruling Muslim League and finance minister he is credited with.","en","news"
"Hot-tempered and outspoken, Kellen Winslow Jr. isn't toning it down just because he's a rookie. Sick, injured and reeling from a humiliating loss, the United States basketball team struggled past Greece 77-71 in an Olympic preliminary-round game that signaled more difficulties to come. Phelps #39;s dreams meet not-so-bad realities ATHENS Imagine,","en","news"
"#39;One in 12 Emails Infected with Virus #39; The number of attempted attacks by computer viruses rocketed in the first half of the year, according to a report published today. A 16-year veteran of the New York Police Department, who supposedly called himself a  quot;boy hunter #39; #39; in an online profile,","en","news"
"Charley a Harbinger of Busy Hurricane Season? But Hurricane Charley intensified at an astonishing rate just a few hours before making landfall, and its eye wobbled off its forecast track and smashed ashore about 70 miles (112 kilometers) south of Tampa, killing at least 21. It became the most. Report:","en","news"
"the world's  second-largest satellite operator, said on Monday it agreed to  be bought by a consortium of four private equity firms for \$5  billion, including assumption of \$2 billion of debt. Stamps. com Asks You to Picture This The online postage service offers a chance to put personal pictures on official stamps.","en","news"
"has signed a five-year agreement with Hewlett-Packard Co. (HP) to manage its IT infrastructure and support about 10, Cisco, Microsoft merge IP telephony with CRM Cisco Systems Inc. is set to offer starting Monday a tool to help small and medium-sized businesses use Microsoft Corp. CRM (customer relationship management) software in combination with a Cisco IP (Internet Protocol) communication system.","en","news"
"Oracle expands midmarket ambitions Company looks to juice its application server business with a version tuned for smaller organizations. Taking the Microsoft Rorschach test CNET News. com's Charles Cooper asks what it is about Microsoft that pushes so many people straight over the edge? Earnings alert: BEA revenue rises amid turmoil Plus:","en","news"
"was 9 for 15 for 69 yards in visiting Oakland's 33-30 exhibition win over the San Francisco 49ers last night. Enough to make you flip Friday night came as close to an old-time local battle for viewers among Channels 4, and 7 as we're likely to see. It was a throwback to pre-cable,","en","news"
"agreed yesterday to be acquired by General Growth Properties, the big owner of shopping centers, for \$7. UPDATE 3-US airlines agree to cut flights at Chicago #39;s O #39;Hare US airlines have agreed to limit flights into Chicago #39;s O #39;Hare International Airport at peak periods to stem record delays that have slowed aviation nationwide,","en","news"
"The New England Patriots signed first-round draft pick Benjamin Watson on Monday, ending the tight end's lengthy holdout. Haas, Cink Join Ryder Cup Team Jay Haas became the second-oldest player to be on the Ryder Cup team, joining Stewart Cink as the two captain's picks Monday for a U. S.","en","news"
"Grieving relatives on Monday cremated victims, mostly women and children, of a separatist bombing in northeastern India, while hundreds of angry people rallied against the rising bloodshed. Chechnya marks 'special' birthday The authorities in war-torn Chechnya announce cash gifts for boys born on the slain leader's birthday. Chvez Is Declared the Winner in Venezuela Referendum The president won the backing of 58 percent of voters,","en","news"
"Beagle team probes its own loss The UK-led Beagle 2 team maintains its Mars lander was probably lost because of unexpected atmospheric conditions during entry. Crisis Alert in Critical State While TV viewers and radio listeners have long suffered through ear-piercing emergency-alert tests, the system has had a spotty record in actual crises.","en","news"
"-son, -this-is-a-court-of-law dept. Iphtashu Fitz writes  quot;The Associated Press recently reviewed many of the copyright infringement lawsuits that the RIAA filed against California should try to add\solar energy systems to 1 million homes by 2017 to save\electricity and cut pollution from power plants, Gov. Arnold\Schwarzenegger said on Friday. A Bulgarian archaeologist has\unearthed an ancient gold mask and a ring featuring an\""Olympic"" rower in what he called an unrivalled find in the\study of classical antiquity.","en","news"
